titulo,local,data,status,texto
BYD Seal novo com lascado e risco no insufilm recusado na entrega: Exijo substituição por veículo sem defeitos,São Paulo - SP,19/11/2025 às 12:10,Em réplica,"Bom dia,Comprei um BYD Seal na concessionária BYD Gran Brasil na Av. Ibirapuera, 1911 - São Paulo. Quando fui retirar o veículo, no dia 29/10/2025, o mesmo tinha um lascado na parte traseira e um risco no insufilm (além da parte interna estar suja em diversos locais) feito na concessionária. Recusei a retirar o veículo pois um veículo zero-quilômetro deve ser entregue em perfeitas condições. Conforme o Código de Defesa do Consumidor (CDC), a sugestão de reparo, como pintura ou troca de para-choque, descaracteriza a condição de carro novo, já que um veículo reparado não é mais considerado ""zero"" e sofre desvalorização no mercado. O ônus de um defeito de fabricação ou manuseio não pode ser repassado ao consumidor. A concessionária fez a troca do parachoque sem o meu consentimento e agora está alegando que a substituiçao de um parachoque não desvaloriza ou faz perder a condição de veículo 0 Km, que trata-se apenas de um ""ajuste estético simples"". Isso obviamente não faz sentido nenhum dado que para retirar e colocar novamente o parachoque tem parafusos, presilhas, etc. o que claramente pode ser afetado por mais que o serviço seja bem feito.Aceitar um carro zero quilômetro com um reparo, mesmo que bem feito, pode implicar em uma desvalorização futura do veículo, pois ele já terá um histórico de reparação, o que não condiz com a expectativa de um carro ""zero"". Por isso, reforço a minha recusa imediata e a exigência de um veículo perfeito.O prazo de 30 dias para conserto, previsto no Código de Defesa do Consumidor (CDC), aplica-se a vícios (defeitos) que surgem após a compra e entrega do produto, quando o consumidor já está com o bem. Nesse caso, a situação é diferente: o vício já foi constatado no ato da entrega (antes da retirada). Eu não sou obrigado a aceitar um produto novo com defeito. Portanto, não se aplica o direito de consertarem em 30 dias. Portanto nesse caso como previsto no CDC solicito a substituição do veículo por outro idêntico, sem defeitos.Obrigado."
Atraso na entrega do carregador do veículo BYD adquirido em 2025,Vila Velha - ES,19/11/2025 às 11:26,Em réplica,"Prezados(as),Venho por meio deste manifestar minha insatisfação em relação à demora na entrega do carregador referente ao veículo BYD adquirido em maio de 2025 na concessionária BYD Vitória Motors de Vila Velha-ES, conforme previsto na promoção vigente à época da compra.Apesar de diversas tentativas de contato e das sucessivas promessas de prazo, até o momento não recebi o carregador, item essencial para a melhor utilização do veículo elétrico e que influenciou diretamente minha decisão de compra.Considerando que já se passaram vários meses desde a aquisição e que se trata de um benefício ofertado oficialmente pela marca, solicito:Entrega imediata do carregador, com previsão formal e comprovada; ouAlternativa compensatória, caso haja indisponibilidade do item, conforme previsto no Código de Defesa do Consumidor.Peço um posicionamento urgente, por escrito, com prazo claro para solução definitiva.Agradeço pela atenção e aguardo retorno.Atenciosamente,*****"
Desgaste irregular de pneus após revisões pagas e não realizadas na BYD,Lauro de Freitas - BA,19/11/2025 às 11:09,Não resolvido,"Compre o corá em junho , fiz 2 revisões aqui na loja BYD Agora 3 revisão , os peneus diateiro estão estão deterioras só na parte de dentro , sendo que a primeira revisão eu paguei pra alinhar, balanceamento , e rodízio dos peneus, e mesmo não foi feito. Acionei a garantia não tive êxito."
Falha no sistema de aviso de revisão e perda da garantia BYD Song Plus,São Paulo - SP,19/11/2025 às 10:59,Resolvido,"Prezados, bom dia! Sou cliente da BYD e tenho um BYD Song Plus GS DM, modelo 2025, cor preta. Adoro o carro e a marca, hoje sou fã n. 1. e recomendo para vários amigos. Fiz minha 1 revisão do veículo em fevereiro/2025. A revisão do carro é a cada 12.000 KM ou 12 meses, o que ocorrer primeiro. Para que não haja problemas, o veículo tem um sistema no software que informa os proprietários da proximidade dos 12 meses para revisão, o que é essencial e, se há esse sistema, ele precisa funcionar corretamente. No entanto, esse sistema não funcionou. A funcionária que me vendeu o veículo me recomendou dar um pulo na concessionária BYD onde comprei o veículo e onde fiz a 1 revisão para verificar o que ocorreu e lá me disseram que o prazo havia passado, pois estaria com 27.000Km.O problema é que o sistema não me informou e o painel não avisou como deveria ocorrer. Tenho uma Mercedes Benz que informa sem parar todas as vezes que você liga o veículo e não para até que você dê baixa.  Não bastasse, a própria concessionária onde fiz a 1 revisão é cheia, os profissionais não dão conta do agendamento dos serviços, difícil resolver a questão, está sempre com muitas pessoas, ao que parece agora a profissional Victoria que me recebeu neste último dia me deu a devida atenção e me informou desse problema. Pedi um relatório para puxar o erro do sistema e me foi dito que era impossível. de igual modo, também não me foi dado nenhum papel ou informação correta de quando eu deveria fazer a segunda revisão - o que é comum nas concessionárias (seja por adesivo colado, ou correta informação do sistema). Gostaria de reaver a garantia do meu veículo, pois pretendo ficar com ele e renovar futuramente por outro que a marca vier a lançar, mas com a perda da garantia terei prejuízos imensuráveis na venda e valor do carro, o que me dificultará a compra de outro, inclusive, da mesma marca. O carro é semi-novo, com baixa quilometragem e, em tese, sem garantia. Gostaria de meus direitos fossem preservados e garantidos, a fim de evitarmos maiores discussões, inclusive, judiciais, pois teriamos que envolver até a própria concessionária. Muito obrigado!"
Demora excessiva e descaso no reparo de BYD Yuan após sinistro em Campinas,Vinhedo - SP,19/11/2025 às 10:32,Em réplica,"Comprei meu BYD Yuan dia 24/07/2025, retirei o veiculo dia 11/08/2025, infelizmente tive um sinistro dia 12/10/2025, meu carro foi levado para a Oficina da concessionária em Campinas, ai começa meu dilema. O carro é otimo, mas o serviço da BYD é [Editado pelo Reclame Aqui]. Meu carro chegou na oficina dia 15/10, os reparos do meu veiculo foram autorizados dia 22/10/2025 cedo, tentei contato a manha inteira no whatsapp da oficina e nada, liguei mandei mensagem fui ter retorno as 18:12 apos eu cobrar uma posição incessantemente e a resposta é que nao constava no sistema, mas sabemos que seque olharam, mandei a autorização da seguradora e nada. Dia 23 novamente cobrei o pedido das peças e nada, foram me enviar um esboço de pedido de peças dia 27 apos cobrar diariamente, pois bem ja abrir 2 sacs tanto na fabrica quanto na concessionária e pasmem nao tive um retorno.do dia 22/10 que foi aprovado os reparos eles foram começar a mexer no meu carro dia 13/11/2025, ou seja, 20 dias um verdadeiro descaso com o cliente. (avisei que dependo do veiculo para trabalhar todos os dias em outra cidade, mas simplesmente ignoraram), entao dia 13/11 aumentaram o orçamento de 37 mil para 70 mil, a seguradora aprovou e adivinhem??? hoje dia 19/11 nem sequer fizeram o pedido das peças para fabrica e apos fazer o pedido a fabrica tem ate 20 dias uteis para enviar. Quando meu carro ficara pronto????O carro é otimo mas o serviço de voces é [Editado pelo Reclame Aqui], funcionarios com descaso com os clientes, nao tem um pingo de respeito, mas considerando que nem o sac de vcs respondem mostra que o desrespeito é cultural da empresa BYD. Hoje tentei novo contato com a oficina BYD Campinas e claro sem sucesso.Meu marido tem um GWM e o atendimento é muito melhor, entao meu conselho a todos, nao comprem carro da BYD, se quiserem um carro eletrico, busque outra empresa que tenha respeito pelos clientes."
Dificuldade de vincular carro ao aplicativo BYD e entrega sem placa,São Paulo - SP,19/11/2025 às 10:05,Respondida,"COMPREI UM BYD YUAN PRO NA BYD DEALER MOOCA. NFE-0005484 , FAZ 1 SEMANA, TENTO VINCULAR O CARRO AO APLICATIVO DA BYD PARA TER AS FUNCOES REMOTAS, POREM ESQUECE, NAO DA, TENTEI LIGAR VARIAS VEZES NO TEL. *****, MAS SEM SUCESSO, UM DESCASO, FORA, QUE ME ENTREGARAM O CARRO, SEM PLACA, MESMO COM DOCUMENTAÇAO PAGA, QUERO VIAJAR NAO POSSO PQ NAO TEM PLACA, PELO VISTO TEREI QUE ACIONAR O TRIBUNAL DE PEQUENAS CAUSAS PQ CANSEI QUE LIGAR E NAO RESOLVEM"
Atraso na entrega do Wallbox prometido na compra do Song Pro,Goiânia - GO,19/11/2025 às 09:43,Em réplica,"Comprei um Song Pro em abril, ganhei um wall box na venda, me deram 90 dias pra entregar já tem mais de 180 dias e nunca me dão uma data pra entrega do wallbox."
Negativa indevida de garantia Difusor de ar central BYD Tan 2022,Natal - RN,19/11/2025 às 01:36,Em réplica,"A concessionária negou cobertura de garantia da peça difusor de ar central direito (quebrou com uso normal, peça plástica do painel) alegando ausência de comprovante da 1 revisão realizada pelo proprietário anterior.Conforme a própria tabela de revisões do manual BYD, a 1 revisão (5.000 km ou 6 meses) NÃO inclui qualquer inspeção ou manutenção no sistema de ar-condicionado ou acabamento interno. Portanto, não existe nexo de causalidade entre a falta dessa revisão e a quebra da peça por fadiga de material.A concessionária não me forneceu protocolo ou laudo técnico por escrito.Trata-se de vício de produto (art. 18 e 26 do CDC) e prática abusiva (art. 39, I e V do CDC).Solicito a cobertura integral da peça + mão de obra em até 10 dias úteis, sob pena de medidas judiciais e registro no Procon-RN."
Vício oculto na caixa de direção após múltiplas trocas e fim da garantia,Rio de Janeiro - RJ,18/11/2025 às 21:59,Em réplica,Trocaram 3 caixas de direção e não ficou bom agora a terceira também está ruim e agora vem a notícia que acabou a garantia isso se chama vício oculto eles te enrolam até acabar a garantia
Atraso na emissão da nota fiscal de veículo PCD,São José dos Campos - SP,18/11/2025 às 18:40,Respondida,"Encomendei o carro desde de setembro, docto de PCD ta aprovado e a montadora ñ da nenhuma posição sobre o faturamento e a nota fiscal"
Atraso na reposição de peça e falta de carro reserva para BYD com motor condenado,Duque de Caxias - RJ,18/11/2025 às 17:30,Respondida,"O carro foi deixado na concessionária BYD Caxias dia 05/11 e foi diagnosticado que o motor do carro deveria der substituto no dia 10/11, e até hoje, dia 18/11 não foi pedido a peça para reposição. Se já não bastasse, um carro zero, com pouco mais de 2 meses de uso, ter sido condenado o motor, estou notando um descaso por parte da BYD, já que o código de defesa do consumidor,  estabele o prazo de 30 dias para a entrega do carro pronto e em condições plena de dirigibilidade, mas fui informado que a peça demora de 10 a 20 dias úteis,  e ainda nem foi pedida, como isso é possível? Exijo uma resposta imediata, ou terei que assim que o prazo termine, tome outras medidas. Preciso de uma resposta urgente, o carro foi comprado para trabalho, e não estou usando o carro, logo não poderei honrar com as prestações.  Aguardo um retorno positivo.Observação: Foi disponibilizado um carro a combustão durante 7 dias, fiz a entrega hoje e até o momento não tenho uma solução mediante ao problema do carro, o pedido que eles enviaram para o setor responsável para pedir a peça ainda nem foi expedido, e há uma completa falta de transparência e compromisso com o cliente. A BYD Brasil deveria rever seus conceitos em relação à suporte no pós venda e fornecimento de peças, e digo mais, oferecer um carro reserva à combustão para uma pessoa que compra um carro elétrico, visando diminuir os gases do efeito estufa. Exijo uma solução imediata."
Dolphin Mini 2025 perdendo carga ao estacionar sem solução da BYD e JRCa,Maceió - AL,18/11/2025 às 16:26,Em réplica,"Título:Dolphin Mini 2025 perdendo 13% de carga ao estacionar; BYD e JRCa não solucionamDescrição:Possuo um BYD Dolphin Mini 2025 e, desde julho de 2025, enfrento um problema recorrente: toda vez que estaciono, desligo e travo o veículo, ele perde entre 1% e 3% de carga, reduzindo de forma significativa a autonomia diária. Quando não travo, não perco % de bateria. Tentei resolver a situação de maneira amigável com a concessionária JRCa, em Maceió, e também com a Central Nacional da BYD. No entanto, a resposta tem sido sempre a mesma: dizem que o comportamento é normal, o que não condiz com a experiência de outros proprietários e nem com o que se espera de um veículo novo. O carro já foi levado para averiguação por 4 vezes. Sem sucesso. Na última vez, passou uma semana imobilizado para ""testes"" e o resultado foi: tudo normal! Solicitei o detalhamento técnico dos diagnósticos realizados, mas fui informado de que tais informações seriam internas e, portanto, não seriam disponibilizadas ao consumidor. Essa falta de transparência impede que eu entenda o que realmente está acontecendo com o carro.Segundo a concessionária, foi realizado teste na bateria 12V, mas nada foi diagnosticado. Ainda assim, o problema persiste todos os dias.Estou desde julho tentando obter uma solução, sem qualquer avanço real. Diante da perda constante de carga, da redução da autonomia e da ausência de clareza técnica, solicito:1.Diagnóstico completo e detalhado, com laudo acessível ao consumidor.2.Correção definitiva do problema ou encaminhamento para avaliação em nível superior dentro da BYD.3.Transparência total sobre o que está sendo analisado.Aguardo retorno urgente, pois a situação afeta diretamente o uso do veículo e causa prejuízo contínuo."
Negativa de garantia e falta de registro de revisão atrasam reparo de veículo BYD Dolphin Plus,Ribeirão Preto - SP,18/11/2025 às 15:42,Respondida,"Prezados,Comprei meu veículo BYD Dolphin Plus 23/24, atualmente com 29.600 km, na concessionária BYD Ermano Marchetti, por intermédio da vendedora Elisete.Recentemente precisei abrir um pedido de garantia devido a um defeito no volante, que apresenta enrugamento no material na parte superior, conforme fotos já enviadas. A concessionária BYD de Ribeirão Preto, onde realizo o atendimento, verificou o problema, confirmou o defeito e encaminhou o caso para garantia.Entretanto, fui informado de que a garantia não pôde ser aprovada porque a BYD Ermano Marchetti não lançou a revisão no portal da BYD, mesmo eu tendo apresentado as fotos do manual com todas as revisões realizadas conforme solicitado. Esse erro está atrasando o processo e me prejudicando.Peço, por gentileza, que regularizem imediatamente o lançamento da revisão no portal, para que a substituição do volante possa ser autorizada sem novos atrasos.Além disso, reforço a necessidade de avaliar novamente a caixa de direção, pois o veículo apresenta um barulho já relatado anteriormente, mas que não foi identificado pelo chefe da oficina.Aguardo um retorno com a máxima urgência, considerando que tudo está parado devido a um procedimento administrativo que deveria estar regular desde a revisão realizada.Atenciosamente,*****"
BYD Cupom de Recarga Promocional NÃO FUNCIONA e ninguém resolve,Florianópolis - SC,18/11/2025 às 15:37,Em réplica,"Comprei um veículo BYD São José no dia 26/07/2025 recebi o carro no dia 05/08/2025 e recebi, no ato da compra, a promoção descrita no documento em anexo (cupom de recarga via aplicativo BYD Recharge). De acordo com a própria BYD, eu teria direito ao benefício mediante cadastro do chassi no app, dentro das regras apresentadas.Após a espera dos 45 dias. Desde então, NÃO consegui utilizar o cupom de recarga, mesmo seguindo todos os passos informados no documento oficial da marca.Já tentei resolver de todas as maneiras possíveis: Suporte da Tupi (operadora do carregamento) disseram que não conseguem habilitar. Concessionária BYD onde comprei o veículo não resolveram. Meu vendedor não conseguiu solução. Pós-venda da BYD também não conseguiu habilitar o benefício. Mesmo apresentando o documento oficial que informa claramente o direito ao benefício, ninguém assume responsabilidade e ninguém resolve o problema. Cada um joga a responsabilidade para o outro.Estou extremamente insatisfeito, pois é um benefício promocional vinculado à compra do veículo, e eu cumpri todas as condições. Preciso que a BYD regularize imediatamente o cupom, conforme anunciado e comprovado, ou apresente uma solução equivalente.Aguardo retorno da BYD com urgência, pois já tentei todos os canais possíveis sem sucesso."
Ventoinha ligada constantemente e baixa autonomia da bateria BYD Dolphin,Goiânia - GO,18/11/2025 às 14:46,Em réplica,"Tenho o Byd Dolphin a quase 1 ano e meio, e + ou - 2 meses percebi que a ventoinha do veículo está ficando 100% do tempo ligada, mesmo quando estou sem utilizar o Ar Condicionado. E espantosamente também está com a ventoinha ligada 100% do tempo do carregamento, o que não é correto. Levei o técnico indicado pela própria Byd que fez a instalação do meu ALL Box e não constatou nenhum problema no ALL Box. Levei o veículo no meu vizinho que tem um veículo igual ao meu até o ano é igual, liguei o meu veículo no ALL box dele e a ventoinha ligou imediatamente, sendo que o veículo dele carrega + ou - 5 horas e liga a ventoinha pouquíssimas vezes. Levei o veículo dele na minha casa e ligamos no meu ALL box, carregou sem ligar a ventoinha, isso está descartado problema no ALL box. Fiquei mas alguns dias com veículo até dar a data do agendamento que fiz junto a Saga Byd, e percebi que com a bateria cheia não estava conseguindo fazer nem 200km de autonomia... Creio pq a ventoinha está 100% do tempo ligada, mesmo sem o Ar condicionado. Entreguei o veículo na Saga Byd, ficou 6 dias lá e falaram que era uma atualização da Byd e que tinha resolvido, mas nada resolveu, pelo contrário autonomia e percentual de bateria caindo rapidamente, mesmo tendi andado pouquíssimo. E a ventoinha continua ligado sem o Ar condicionado e 100% do tempo de carregamento. Essa ventoinha ligada está fazendo consumir muita energia aí carregar e também na autonomia do veículo que quase não chega a 200km de autonomia com a bateria cheia Preciso de uma solução urgente pq utilizo o veículo para meu sustento financeiro. Amanhã cedo, dia 19/11/2025, deixarei novamente o veículo na Saga Byd Goiânia e preciso que vocês sejam mais pontuais para resolver a questão.Aguardo retorno tanto da saga quanto da Byd"
Suspensão quebrada em veículo BYD com 7 meses: alegação de batida sem evidências e recusa de garantia,Manaus - AM,18/11/2025 às 14:46,Respondida,"Levei o veículo na concessionário de BYD Manaus por um ruído na suspenção. Foi evidenciado que a bandeja da suspenção está quebrada, porém o auto tem 7 meses e está na garantia. A minha surpresa foi que a funcionária alega que a quebra teria sido por ""batida"" porém a peça não tem nenhum sinal de amassado para justificar esa teoria, logo alegaram que a batida teria sido ""na roda"", porém a roda tambem não tem nenhum sinal de amassado que justifique a quebra de uma peça de ferro desse porte. Encaminharam um vídeo mostrando a roda ""girando"" para indicar que a mesma estaria amassada, pedi para me indicarem ""pontualmente"" o local onde teria sido o amasso ou [Editado pelo Reclame Aqui] para partir a peça, e só ficam insistindo na mesma argumentação. Ou seja. Não querem admitir que a peça quebrou por defeito de fábrica. E ficam inventando escusas."
Dificuldade em agendar revisão de 60.000 km na concessionária BYD em São José dos Campos - SP,São José dos Campos - SP,18/11/2025 às 13:37,Respondida,"Tenho um BYD Yuan Plus e moro em Guaratinguetá - SP. Minhas revisões precisam ser em São José Dos Campos pois é a cidade mais próxima com apoio de concessionária com suporte para tal inspeção. Meu carro completou 60mil km há mais de 1 mês e meio e não consigo agendar com a loja de São José dos Campos. Eles não me atendem, quando mando WhatsApp eles começam a responder e param. Não dão andamento no meu atendimento. Estou tentando agendar há mais de um mês. Estou receoso de dar alguma pane no meu carro por falta de inspeção. Mas eu quero deixar registrado minhas tentativas. Meu carro está com 64mil km e ainda não obtive sucesso na tentativa de agendar."
Defeito no airbag após 5 meses de uso e recusa de reparo na garantia,Belo Horizonte - MG,18/11/2025 às 13:03,Respondida,então eu fiz uma compra de um Bear de Song pro na Vitória Motors que é na cidade de Nova Lima em Minas Gerais no dia 29 de maio de 2025 pela nota fiscal o carro foi produzido um ano atrás em junho de 2024 após 5 meses de uso o carro começou a dar problema e acender a luz de airbag falando que havia um problema então eu levei a concessionária e a concessionária constatou ruptura do cabo do Fio né da do Airbag que fica no assoalho do carro logo próximo da lateral segundo ela esse defeito não é de fábrica não sei como é um que é um problema que não é aparente senão consegue ver visualizar e eles falaram que foi provocado depois da venda provavelmente não eu só tem 5 meses de uso e ele se recusaram a fazer o reparo dentro da garantia
Dificuldade no cadastro de veícul.,Uberlândia - MG,18/11/2025 às 12:51,Respondida,"Estou no meu terceiro veiculo da marca, nunca tive problemas, até comprar um veículo usado.Tentei cadastrar o veiculo no meu app BYD, para poder controlar, saber a localização e etc, porém por ser usado o procedimento é diferente.Então tentei ligar em TODOS os números de Sac e atendimento ao cliente no site da BYD, o único que atendem é o 0800 723 1314, porém nao conseguem ajudar em absolutamente nada, e instruem a ligar em números que nao existem, frustrando ainda mais a experiência do cliente. Um descaso total, uma marca que começou a vender tanto não ter um SAC de verdade."
Demora na entrega do manual do proprietário e falta de comunicação da concessionária BYD Vila Velha.,Vila Velha - ES,18/11/2025 às 12:46,Respondida,"Pior pós venda que já vi em toda minha vida, no dia 13/02/25 efetuei a compra de um BYD KING na concessionária BYD de Vila Velha, desde então peguei o veículo sem o manual do proprietário e de revisões, com a promessa que seria entrega em 30 dias, pois estava em falta na concessionária (absurdo). Continuei entrando em contato com o pós venda da concessionária durante os próximos meses, e nada de me entregarem o Manual do carro, e pronto.. já se passaram 10 meses e hoje 18/11/25 continuo sem o manual do meu veículo!! Simplesmente pararam de me responder, e ignoram todas as mensagem. Essa dificuldade toda pra conseguir 1 manual, fico imaginando quem precisa de peça de reposição ou de outros serviços da BYD Vila Velha. Aguardo o retorno e sim com uma solução pro meu caso, chega de enrolação e desculpas."
Ligações excessivas para pesquisa de satisfação após serviço na concessionária BYD,São Paulo - SP,18/11/2025 às 12:11,Não respondida,"Troquei o pneu na BYD Deahler Nações Unidas no dia 07/11 e desde então estou recebendo várias ligações por dia de números não identificados (aparece +0) pedindo pra responder pesquisa sobre atendimento. Já entrei em contato com a concessionária por whatsapp do pós-venda e falei com eles diretamente por telefone hoje e informaram que era uma empresa de pesquisa e que iam tirar o meu contato de lá. Advinha o que aconteceu, continuo recebendo ligações da pesquisa. Isto é um absurdo, estão me incomodando várias vezes ao dia com números não identificados e não sou obrigado a responder nenhuma pesquisa. E se for responder a resposta seria PÉSSIMO TRATAMENTO COM O CLIENTE, INCOMODO DIÁRIO."
