titulo,local,data,status,texto
"Sistema multimídia do BYD Song Pro GS reinicia durante uso do Android Auto/Apple CarPlay, impossibilitando a navegação e comprometendo a segurança.",Pelotas - RS,09/11/2025 às 22:38,Respondida,"Sou proprietário de um BYD Song Pro GS, morador do Rio Grande do Sul, e estou extremamente insatisfeito com o sistema multimídia do veículo.Sempre que estou viajando e utilizando Android Auto/Apple CarPlay com o Waze, o sistema começa a reiniciar sozinho diversas vezes, sem qualquer possibilidade de parar o processo.Os principais problemas causados por essa falha:O multimídia reinicia repetidamenteO Waze fecha e as rotas em andamento são perdidasQuando retorna, abre o Spotify sozinho, mesmo que eu estivesse ouvindo rádioA instabilidade torna a navegação inviável e inseguraEm viagens, não consigo confiar no GPS do carroEntendo que, se o veículo está em rota guiada, o mínimo esperado é que o sistema não feche nem reinicie até que o trajeto finalize.Levei o carro mais de uma vez à concessionária BYD, porém a justificativa foi de que o problema seria relacionado ao sinal da operadora Claro no RS.Essa alegação não procede, pois:Já viajei para Santa Catarina, e o problema continua exatamente o mesmoEm outro veículo que eu possuía (Renault Duster), com o mesmo celular e isso NUNCA aconteceuSegundo a BYD, uma atualização prevista para dezembro irá corrigir parcialmente o problema.No entanto, isso não é aceitável: o sistema deve funcionar 100%, não ""em partes"", principalmente em um item básico como espelhamento de celular e navegação.Além do exposto, deixo outra sugestão de melhoria urgente:As rádios salvas deveriam ser acessíveis por botões, e não apenas por listaO tamanho atual é muito pequeno para tocar com segurança, atrapalhando a usabilidade"
"Dolph GS descarregou após 15 dias de uso e não carrega, impossibilitando viagem.",Penedo - AL,09/11/2025 às 22:16,Não respondida,"Nessa sexta-feira dia 7 de novembro Estava andando com meu Dolph GS Comprado a 15 dias Quando estacionei Tinha 13 por cento de bateria E quando voltei que fui ligar o carro Estava com zero por cento de bateria o carro não funcionava mais Então liguei para assistência Solicitando guincho Pra levar o carro para minha casa pra dar uma carga porém Não aceitava a carga não carregou mais Liguei de novo pra assistência pedindo o guincho pra levar para autorizada na cidade mais próxima Estava com uma viagem marcada de um casamento da família, trazendo Muito transtorno E constrangimento Estou frustrado com o carro Não tenho mais segurança nele Não quero mais esse carro quero devolver Obrigado"
Pneu de BYD DOLPHIN MINI rasgado ao passar por tachão e suspeita de defeito de fábrica,Salvador - BA,08/11/2025 às 19:02,Em réplica,"No mês de setembro de 2025, fiz a compra de um BYD DOLPHIN MINI 25/26. Ontem passei por um maior sufoco. Simplesmente o pneu dianteiro do lado direito rasgou ao passar por um TACHÃO (redutor de velocidade).Entrei em contato com a BYD, e a mesma contactou o guincho para conduzir o veículo até a concessionária. Ao chegar fui informado que teria que trocar os dois pneus, pois não tinha da marca HANKOOK, e segundo a concessionária, a recomendação da BYD é não colocar pneus no mesmo eixo de marcas diferentes. Fiz a compra dos dois pneus, e quando estava realizando a troca. Observei que o pneu que havia sido rasgado estava esfarelando por dentro. Sendo assim subtendesse que o pneu já estava com algum defeito de fábrica, e não deveria ter rasgado ao passar por um TACHÃO (redutor de velocidade), pois é algo comum no trânsito.Me atentei que estive algumas vezes na concessionária, e vi alguns DOLPHIN MINIS com o mesmo problema. "
Wallbox com defeito há mais de um mês e garantia não resolve o problema,Brasília - DF,08/11/2025 às 14:05,Resolvido,"Há mais de um mês meu wallbox (carregador) deu defeito, foi acionada a garantia e até agora não arrumou o problema. A concessionária (Bali SAAN DF onde o veículo foi adquirido) alega ser um problema/ responsabilidade da a montadora."
Atraso na entrega de veículo comprado há mais de 30 dias,Imperatriz - MA,08/11/2025 às 12:09,Respondida,Estão bancando [Editado pelo Reclame Aqui] comigo comprei o carro já se passou dos 30 dias o carro já se encontra na concessionária mas estão com dificuldade para me entregar o veículo
Negativa indevida de carro reserva para BYD Yuan com defeito na mangueira de refrigeração da bateria,Brasília - DF,08/11/2025 às 11:47,Respondida,"Sou proprietário de um BYD Yuan, adquirido em setembro de 2023. Recentemente, o veículo apresentou um defeito de fábrica em uma mangueira do sistema de refrigeração da bateria. Fui informado pela concessionária que o carro precisará permanecer retido até a chegada da peça de reposição, o que me impede de utilizá-lo durante esse período.Segundo a própria concessionária, trata-se de um defeito coberto pela garantia, e o prazo estimado para a chegada da peça é de aproximadamente dois meses (35 dias úteis). Também fui informado de que, nessas situações, eu teria direito a um carro reserva.No entanto, ao entrar em contato com a central de atendimento, o fornecimento do veículo reserva foi indevidamente negado, sob a justificativa de que o carro possui mais de dois anos de uso, o que não faz sentido, pois o defeito está dentro do prazo de garantia e é de natureza fabril.Utilizo o veículo diariamente para o trabalho, e a impossibilidade de usá-lo acarretará custos significativos com aluguel de outro automóvel. Diante disso, solicito um posicionamento urgente e a revisão da negativa de fornecimento do carro reserva, conforme previsto na política de garantia e no Código de Defesa do Consumidor."
Barulho excessivo e defeito nos pneus Ling Long do BYD Dolphin Plus após 18.000 km e recusa da garantia,São Paulo - SP,07/11/2025 às 18:47,Respondida,"FUI UM DOS PRIMEIROS CLIENTES DA BYD A COMPRAR UM DOLPHIN EV, APÓS O SEU LANÇAMENTO, E, INICIALMENTE, FIQUEI SATISFEITO COM O CARRO. COM A CHEGADA DO DOLPHIN PLUS, FIZ A TROCA POR ESTE MODELO NA CONCESSIONÁRIA BYD DAHRUJ DE JUNDIAÍ. CONTUDO, APÓS UM PERÍODO COM O VEÍCULO (APROXIMADAMENTE 18.000 KM), UM FORTE BARULHO DE ROLAMENTO COMEÇOU A SURGIR. TÃO FORTE QUE, QUANDO VEÍCULO PASSAVA PELA RUA, AS PESSOAS OLHAVAM COM SURPRESA. QUANDO UMA PESSOA ADQUIRE UM VEÍCULO ELÉTRICO, O MÍNIMO QUE ELA ESPERA É O SILÊNCIO QUE, EM TESE, DEVERIA SER PROPORCIONADO. LEVEI O CARRO PARA A CONCESSIONÁRIA DAHRUJ BYD EM JUNDIAÍ A FIM DE VERIFICAR A CAUSA DE TAMANHO BARULHO, E, INICIALMENTE, TERIAM DITO QUE ""ERA O BARULHO NORMAL DO ATRITO DO PNEU COM O PISO"". IRRESIGNADO, RESPONDI QUE A ALEGAÇÃO ERA FALACIOSA, UMA VEZ QUE ATÉ AQUELE MOMENTO, O CARRO ERA SILENCIOSO. APÓS ISTO, O CHEFE DA OFICINA RESOLVEU ABRIR O JOGO E DISSE QUE O BARULHO ERA DECORRENTE DE DEFEITO DE FABRICAÇÃO DOS PNEUS LING LONG QUE EQUIPAVAM O VEÍCULO E QUE A ÚNICA ALTERNATIVA PARA RESOLUÇÃO DO PROBLEMA SERIA A TROCA DOS 4 PNEUS DEFEITUOSOS. PEDI A SUBSTITUIÇÃO NA GARANTIA, MAS ALEGARAM QUE JÁ HAVIA PASSADO O PRAZO E A QUILOMETRAGEM E NEGARAM-SE A FAZER. VEJAMOS, A MONTADORA VENDE UM VEÍCULO COM UM PNEU COM DEFEITO DE FABRICAÇÃO CONHECIDO POR ELA (O PRÓPRIO CHEFE DA OFICINA RELATOU QUE TEM RECEBIDO VÁRIOS DOLPHIN PLUS COM O MESMO PROBLEMA) E, CASO O CONSUMIDOR TENHA O AZAR DO DEFEITO SÓ ECLODIR APÓS O TÉRMINO DA ""GARANTIA"", ELE QUE TERÁ QUE DISPENDER OS VALORES PARA A RESOLUÇÃO DO PROBLEMA.ALÉM DE TER SIDO UM DOS PRIMEIROS A ADQUIRIR UM DOLPHIN EV, MINHA ESPOSA FOI UMA DAS PRIMEIRAS A COMPRAR UM SONG PLUS, MAS A MARCA TRATA OS CLIENTES COM UM DESCASO QUE CAUSA ESPANTO. AGORA QUEM DEU DEFEITO FOI O SONG PLUS DA MINHA ESPOSA, E A BYD, AO INVÉS DE RESOLVER PRONTAMENTE, FICA TENTANDO POSTEGAR A SOLUÇÃO DA QUESTÃO. ENFIM, UMA MARCA QUE DEFINITIVAMENTE NÃO MERECE A ATENÇÃO DO CONSUMIDOR E QUE VENDE PRODUTOS QUE NÃO ATENDEM UM NÍVEL DE QUALIDADE SATISFATÓRIO. [Editado pelo Reclame Aqui] MARCA, NUNCA MAIS COMPRAREI UM PRODUTO DA BYD E FAREI QUESTAO DE AVISAR OS DESPREVENIDOS DO PROBLEMA QUE É ADQUIRIR UM CARRO DESTA MARCA. "
Wallbox BYD com defeito e demora na substituição,São Leopoldo - RS,07/11/2025 às 16:47,Resolvido,"Fiz a aquisição na BYD IESA Porto Alegre de um Yuan plus no final de maio, feita a instalação do Wallbox pelo instalador credenciado para não perder a garantia e ter todo o suporte da BYD. A instalação foi feita 12 de junho e eis que 9 de setembro o mesmo parou de ler o cartao e nao funciona desde então. Veio o técnico da instaladora e fez o laudo apontando o defeito do aparelho e indicando pela sua substituição. Desde lá estou aguardando (vão fazer dois meses) e sem previsão de substituírem o carregador wallbox . E a cada novo carro que vendem diariamente entregam um carregador novinho e o meu que é a substituição de um que apresentou defeito não tem nenhuma previsão."
Cobrança abusiva e falta de padronização nos valores de revisão do BYD Song Plus,Fortaleza - CE,07/11/2025 às 16:35,Respondida,"Sou proprietário de um BYD Song Plus 2023 e venho expressar minha total insatisfação com o pós venda da BYD, especialmente em relação à segunda revisão do veículo.De acordo com o tabelamento oficial divulgado pela própria montadora BYD Brasil, a revisão sugerida para 24.000 km tem o valor de R$ 1.284,00, valor este amplamente divulgado como referência nacional até 30/11/2025.Entretanto, ao levar meu carro para a concessionária BYD Barão de Studart (Fortaleza CE), fui surpreendido com um orçamento de aproximadamente R$ 2.200,00, que ainda poderia chegar a R$ 2.900,00 com itens opcionais.Isso é um desrespeito com o consumidor, que confia nas informações oficiais da marca ao adquirir um veículo de alto valor.Em nenhum momento o material oficial da BYD menciona que o valor da revisão muda por tempo, apenas que deve ser feita a cada 12.000 km ou 12 meses, o que ocorrer primeiro.Para reforçar minha indignação, consultei as revisões de outras marcas como Jeep, Toyota e GWM (links abaixo), todas elas mantêm o mesmo valor para revisão por tempo ou quilometragem, cumprindo exatamente o que prometem aos clientes.Jeep: https://www.jeep.com.br/proprietarios/revisao-programada.htmlToyota: https://www.toyota.com.br/meu-toyota/servicos/revisoes-periodicasGWM: https://www.gwmmotors.com.br/pt/servicos/revisoesEnquanto isso, a BYD permite que cada concessionária cobre valores completamente fora da tabela, sem transparência e sem coerência com o próprio material da marca.Sinto-me enganado e desrespeitado como cliente, já que um dos principais argumentos de venda do Song Plus é o baixo custo de manutenção, o que na prática não é o que acontece.Peço providências urgentes da BYD Brasil para que haja padronização nacional dos valores de revisão, conforme divulgado oficialmente, e para que seja revisto o procedimento da concessionária BYD Barão de Studart, que está praticando valores abusivos e distorcendo a imagem da marca.A expectativa de quem compra um veículo BYD é ter um pós venda confiável, transparente e ético, e o que estou vivenciando é o oposto disso. Foi aberto um protocolo de reclamação sem nenhum retorno rápido Protocolo reclamação- *****."
Não cumprimento da promoção '48 horas eletrizantes' - voucher de recarga não disponibilizado,Natal - RN,07/11/2025 às 16:04,Respondida,"Comprei um carro da BYD em julho de 2025 durante a vigência da promoção ""48 horas eletrizantes"", a qual prometia R$ 1.500,00 à título de voucher de recarga em eletroposto e 1 ano de revisão grátis. No entanto, o referido crédito de recarga ainda não foi disponibilizado, mesmo passados mais do que os 45 dias úteis informados pela BYD para disponibilização."
Vazamento de fluido e falta de veículo reserva: cliente BYD insatisfeito com espera para diagnóstico e ausência de carro reserva.,São Paulo - SP,07/11/2025 às 15:29,Resolvido,"Veículo com problemas de vazamento de fluido na roda traseira direita constatado pela concessionária. Concessionária nao realizou diagnóstico alegando atraso por falta de funcionários na sexta-feira dia 07/11/2025Quando fiz contato com o SAC BYD a empresa informou q nao disponibilizará veiculo reserva antes de 2 dias. Como o diagnóstico será realizado apenas no dia 10/11/2025, nao houve empatia do SAC em disponibilizar o veículo reserva, deixando o cliente, portanto, pelo menos, 6 dias sem locomoção."
"Não cumprimento da oferta de revisão, recarga e documentação do Dolphin Mini",Salvador - BA,07/11/2025 às 14:36,Respondida,"Comprei um dolphin mini no dia 26/07, e na oferta da compra, oferecia 1 ano de revisão grátis, 1 ano de recarga grátis(1500,00) e a documentação com placa! Porém até hoje o crédito da recarga não foi oferecido, na promoção informava que era em até 60 dias, porém já passou e muito dessa data! Seria o caso de propaganda enganosa?"
Não recebi voucher de carregamento prometido na compra do BYD,Brasília - DF,07/11/2025 às 13:58,Em réplica,"Comprei um carro elétrico BYD com a promessa de receber um voucher de R$1.000 para carregamento em até 45 dias úteis após a entrega, realizada em 19/08/2025. Já se passaram mais de dois meses e o voucher não foi entregue.Procurei o vendedor da BYD Vitória Motors, que informou ser apenas concessionária e me orientou a entrar em contato com o SAC da BYD. Após semanas de espera, recebi apenas um e-mail dizendo que o caso seria encaminhado ao setor responsável, e desde então não obtive mais retorno.Solicito uma posição e a entrega do voucher prometido."
Não cumprimento da promessa de entrega do carregador Wall Box e falha no pós-venda da BYD.,Maceió - AL,07/11/2025 às 13:39,Em réplica,"No dia 28/05/2025 comprei um Song Pro GS avista e no ato da compra foi prometido um carregador Wall Box de cortesia pela montadora e até esse momento não chegou, tive na loja em Maceió, onde comprei o carro e informaram que até o momento a montadora não havia mando meu Wall Box. Já mandei e-mail para empresa em 01/10/2025 e não tive nenhum retorno.  Estou muito decepcionado com o pós-venda da BYD, que não consegue resolver o meu problema e quando eu ligo pra central, informam que a responsável pelo meu caso vai entrar em contato em até 02 horas e até hoje ninguém liga e não resolvem o problema.   Segue número do protocolo: *****"
Dificuldade no acesso e configuração da chave digital via aplicativo BYD Dolphin GS.,Feira de Santana - BA,07/11/2025 às 12:37,Respondida,"Sou proprietário de um BYD Dolphin GS e estou enfrentando dificuldades no acesso e configuração da chave digital via aplicativo oficial da BYD. Poderiam, por gentileza, me orientar sobre o procedimento correto ou a necessidade de uma intervenção técnica?"
BYD Dolphin GS 2025: Liberação da chave digital NFC pendente,Porto Alegre - RS,07/11/2025 às 12:03,Respondida,"Olá, sou proprietário de um BYD Dolphin GS 2025 e até o momento a função de chave digital (virtual key / NFC) ainda não foi habilitada no meu veículo.Entrei em contato com o suporte da BYD por telefone, mas fui informado de que não podem fazer nada no momento e que eu deveria apenas aguardar o que considero insatisfatório, já que outros proprietários do mesmo modelo relataram aqui no Reclame Aqui que tiveram o problema resolvido rapidamente após a abertura de reclamação.Peço, por gentileza, que a função de chave digital NFC seja liberada também no meu veículo, conforme o recurso anunciado para o modelo GS 2025.Aguardo o retorno da equipe da BYD com a liberação da função.Agradeço desde já pela atenção e agilidade no atendimento."
Atraso na entrega do carregador WALLBOX para veículo BYD adquirido em 22/05/2025,Fortaleza - CE,07/11/2025 às 11:36,Resolvido,"Comprei o veiculo no dia 22/05/2025, conforme proposta anexa, na negociação foi proposto pelo vendedor um carregador WALLBOX, na qual o prazo de entrega estava estipulado para 60 dias úteis, vencendo em 18/09/2025, entrei contato e protocolei uma reclamação com número *****, mas não tive êxito na reclamação, no dia 31/10/2025, entrei com outra reclamação através do protocolo *****, visando solucionar a entrega do equipamento, mas até o momento não obtive retorno por parte da BYD."
Negativa de garantia e demora na solução de carregador de veículo elétrico BYD,Brumadinho - MG,07/11/2025 às 10:03,Respondida,"O equipamento, entregue em garantia, na data de 20/03/25 ,apresentou problema logo em seguia, parando de ligar repentinamente. Logo que o mesmo aparentou o problema, realizei o contato junto a BYD, através do número *****, pois funcionou menos de 3 meses, estando ainda em garantia. Fizeram o registro do atendimento e fiquei aguardando.Recebi em 13/05/25, um contato informando que um técnico da GreenV homologada por vocês, iria vir a minha residência, a fim de realizar a inspeção da instalação do carregador. Porém após varias remarcações, foi realizada em 30/06/25. Entendi que a visita seria para verificar também o carregador que foi trocado em garantia, pois já não estava funcionando.Segundo o técnico, receberíamos o laudo e também a tratativa da nova garantia.Como não tive nenhum retorno, do dia 18/08/25, fui pessoalmente até a concessionário a BYD da Barão, onde comprei DOIS veículos (um apara min e outro para meu irmão) da marca e não havia NENHUM registro do meu problema, tampouco previsão de solução. Realizei todo o protocolo novamente com envio de fotos e demais via WhatsApp e após quase quinze dias recebi a negativa de garantia sem nenhuma explicação e totalmente com DESCASO.Ressalto que o produto foi utilizado/instalado conforme manual e em condições normais de uso (atestado na inspeção técnica) e que a responsabilidade pelo atraso não pode ser imputada ao consumidor, uma vez que a solicitação inicial feita tempestivamente através do canal de atendimento BYD ocorreu dentro do prazo de garantia.Tenho todos os registros, inclusive vídeos da inspeção na minha residência que atestam que a falha se dá pelo produto e tenho buscado de forma harmônica e passiva resolver. Destaco ainda o prejuízo, pois não consigo utilizar o veículo que é totalmente elétrico e não possuo o carregador.Aguardo posicionamento em até 07 (sete) dias uteis, a fim de evitar necessidade de recorrer aos órgãos de defesa do consumidor.Após muita insistência *****, que solicitou que fosse enviado tudo para ele por e-mail com registro e evidencia. Segue anexo e-mail enviado e registro de exclusão do mesmo (por parte da agencia) antes mesmo de ser lido."
Dolphin Gs desliga sozinho com falha de alimentação e demora na entrega do veículo,Porto Alegre - RS,07/11/2025 às 09:58,Respondida,"Dolphin Gs está se apagando sozinho, aparece a mensagem falha de alimentação, seu carro se desligará em 1min , e o carro desliga . Está na via Porto /Byd de Gravataí/RS desde segunda pela manhã dia 03/11/2025 e até agora não me entregam o carro ."
Atraso na entrega de veículos e descumprimento de prazos,Recife - PE,07/11/2025 às 09:13,Não resolvido,Não cumprem prazos. Informam um prazo para entrega dos veículos mas depois que recebem ficam dizendo que tem muitas entregas e que não terão condições de honrar os prazos de entrega.
"BYD vende e não entrega no prazo, péssima experiência pós venda.",Recife - PE,07/11/2025 às 07:53,Não resolvido,"comprei e não recebi, 40 dias esperando e ainda sem previsão de entrega."
Não entrega do veículo BYD Min...,Vila Velha - ES,07/11/2025 às 00:06,Respondida,"fiz a compra de um BYD mini Dolfhin ,no dia 17 de outubro na loja de *****,dei 2000 mil reais de entrada para garantir o carro Me disseram que o carro estava no pátio deles na serra na es 010 ,na segunda-feira dia 20  de outubro, voltei na loja e dei mais 48.000 mil reais somando um valor de 50.000 mil reais  de entrada na compra do carro,me disseram que  ia me entregar o carro aquela semana,na quinta-feira 24/10/25 da mesma semana o financiamento de r$ 69.900 foi passado para o CNPJ*****I.E.: *****EV COMERCIO DE VEÍCULOS LTDA.*****SANTA LUCIA  CEP.: *****PIX (CNPJ)*****DADOS PARA TRANSFERENCIABanco BradescoAg *****Cc ***** até hoje 06/11/25 nao me entregaram o carro pois venderam o carro que não tem no pátio e nem sabe onde se encontra esse chassis. e essa placa desse veículo  que me Venderam já está no meu nome"
Veículo novo com barulho não identificado e falta de solução na concessionária,São Paulo - SP,06/11/2025 às 18:02,Em réplica,"Comprei o veículo e com 7 dias o veículos começou a fazer um barulho não identificado levado imediatamente a concessionária informarão que nada foi localizado, retiramos novamente o veículo e ao viajar o mesmo voltou a dar o mesmo defeito levamos na mesma hora a concessionária o qual o pós venda ***** e ***** alegou que nada poderia ser feito a não ser enviar o carro para oficina ."
Prazo para realizar revisão,Nossa Senhora do Socorro - SE,06/11/2025 às 16:39,Resolvido,"Tenho um song pro,sou médico e trabalho no interior do meu estado. Meu carro necessita fazer a revisão dos 24 mil e a consercionaria não disponibiliza vaga em tempo hábil antes que ultrapasse a quilometragem. Rodo 200km por dia e informaram na última revisão que eu não poderia fazer antes dos 24 mil e nem após os 25 mil KM a consercionaria disponibilizou data de agendamento apenas para o fim do mês. Apois perguntar sobre a garantia já que solicitei o agendamento com 24 mil KM eles relataram um ""encaixe para a próxima semana"" porém até lá o carro já terá passado dos 25mil KM. Quero saber porque não realizar o encaixa para sexta ou sábado então já que se trata de encaixe ? Não tinha esse problema com a Fiat, sempre havia disponibilidade para a revisão na mesma semana e a BYD sempre disponibiliza datas com apenas 1 mês! Quero saber como fica a garantia do meu veículo já que se trata de um problema de disponibilidade da consercionaria e não minhã. Não posso ficar sem utilizar o carro 1 semana!!"
Atraso na entrega do Dolphin Mini da BYD - Propaganda enganosa da vendedora.,Maceió - AL,06/11/2025 às 16:08,Respondida,"Comprei um Dolphin mini nesse mês de outubro/25 pela Parvi BYD e na hora da compra, a vendedora me garantiu que tinha o carro em pronta entrega. Pediu 10 dias úteis pra finalizar a entrega do carro. Quando finalizou a compra, que faturou e tirou nota fiscal, a vendedora e a gerente informaram que na verdade o carro está no pátio da fábrica e que não tem previsão de entrega alegando que é um problema de logística da fábrica. A questão é, se o carro estava na fábrica, e ela sabia disso, porque informou que tinha pronta entrega apenas para fechar a venda? Porque não informou isso antes? Estou tendo esse problema e infelizmente até agora não obtenho nenhuma resposta sobre uma previsão de entrega. Quem for comprar carro da Parvi BYD deve está atento a esse tipo de constrangimento e problema. Carros vendidos mas sem previsão de entrega. Um absurdo.."
Atraso na entrega de carregador portátil BYD Dolphin após 150 dias da compra,Jaraguá do Sul - SC,06/11/2025 às 13:55,Respondida,"Comprei um BYD Dolphin em 09/06/2025, na concessionária BYD Servopa de Curitiba. Na proposta, aderi à campanha de fábrica que concedia bônus em dinheiro e um carregador portátil, com prazo de entrega de até 90 dias condição expressamente prevista no meu contrato.O prazo de 90 dias encerrou em 07/09/2025. Desde 11/09/2025, venho abrindo protocolos na central de relacionamento solicitando posição sobre a entrega do carregador portátil. Tive um problema com o wallbox (já resolvido) e, desde então, necessito do carregador portátil para uso do veículo conforme contratado.Hoje, 06/11/2025, já se passaram 150 dias desde a compra, e, apesar de inúmeras ligações à central de relacionamento, não obtive uma resposta concreta. Há semanas, nem retorno às minhas solicitações eu recebo, mesmo com o descumprimento contratual já configurado.Último protocolo: *****.Ressalto que existem registros desde 11/09/2025, sempre buscando resolver amigavelmente a demanda, sem sucesso.O que eu solicito:Entrega imediata do carregador portátil prometido na campanha e previsto no contrato, com comprovante de envio e prazo de entrega definido,"
